{
  "$schema": "https://json-schema.org/draft/2020-12/schema",
  "$id": "https://harness.example/schemas/memory-entry.schema.json",
  "title": "Memory entry",
  "description": "One note that outlives the run. Notes are data, never instructions; the harness sets origin.",
  "type": "object",
  "required": [
    "id",
    "kind",
    "description",
    "content",
    "origin",
    "createdAt",
    "updatedAt"
  ],
  "properties": {
    "id": {
      "description": "Short slug, unique in the store.",
      "type": "string",
      "pattern": "^[a-z0-9][a-z0-9-]{0,63}$"
    },
    "kind": {
      "enum": [
        "fact",
        "preference",
        "procedure",
        "reference"
      ]
    },
    "description": {
      "description": "One line used to choose what to read.",
      "type": "string",
      "minLength": 1,
      "maxLength": 200,
      "pattern": "^[^\\n\\r]+$"
    },
    "content": {
      "type": "string",
      "minLength": 1,
      "maxLength": 2000
    },
    "origin": {
      "description": "Set by the harness. external_content: written in a run that had read an untrusted source.",
      "enum": [
        "user_statement",
        "agent_inference",
        "external_content"
      ]
    },
    "createdAt": {
      "$ref": "#/$defs/timestamp"
    },
    "updatedAt": {
      "$ref": "#/$defs/timestamp"
    },
    "expiresAt": {
      "description": "Expired entries are not loaded.",
      "$ref": "#/$defs/timestamp"
    },
    "source": {
      "description": "The run and step that wrote the entry.",
      "type": "object",
      "required": [
        "runId"
      ],
      "properties": {
        "runId": {
          "type": "string",
          "minLength": 1
        },
        "step": {
          "type": "integer",
          "minimum": 0
        }
      },
      "additionalProperties": false
    }
  },
  "additionalProperties": false,
  "$defs": {
    "timestamp": {
      "description": "RFC 3339.",
      "type": "string",
      "pattern": "^\\d{4}-\\d{2}-\\d{2}T\\d{2}:\\d{2}:\\d{2}(\\.\\d+)?(Z|[+-]\\d{2}:\\d{2})$"
    }
  }
}
